kestrel-kernels/python/kestrel_kernels/configs/cute_moe_E64_H2048_I1024_bf16_sm90.json
{
  "description": "CuTe MoE kernel configs optimized for H100 (SM90)",
  "generated": "2026-01-04",
  "up": {
    "1": {"block_m": 16, "block_n": 128, "block_k": 256, "num_warps": 4, "num_stages": 2, "time_us": 35.7},
    "2": {"block_m": 16, "block_n": 64, "block_k": 256, "num_warps": 4, "num_stages": 2, "time_us": 49.1},
    "4": {"block_m": 16, "block_n": 128, "block_k": 256, "num_warps": 4, "num_stages": 1, "time_us": 87.4},
    "8": {"block_m": 16, "block_n": 32, "block_k": 128, "num_warps": 4, "num_stages": 3, "time_us": 125.3},
    "16": {"block_m": 16, "block_n": 64, "block_k": 256, "num_warps": 4, "num_stages": 2, "time_us": 161.3},
    "24": {"block_m": 16, "block_n": 32, "block_k": 256, "num_warps": 2, "num_stages": 1, "time_us": 181.0},
    "32": {"block_m": 16, "block_n": 128, "block_k": 128, "num_warps": 4, "num_stages": 2, "time_us": 185.7},
    "48": {"block_m": 16, "block_n": 128, "block_k": 256, "num_warps": 4, "num_stages": 1, "time_us": 189.4},
    "64": {"block_m": 16, "block_n": 128, "block_k": 128, "num_warps": 4, "num_stages": 5, "time_us": 194.2},
    "96": {"block_m": 32, "block_n": 128, "block_k": 128, "num_warps": 4, "num_stages": 2, "time_us": 192.5},
    "128": {"block_m": 64, "block_n": 256, "block_k": 128, "num_warps": 8, "num_stages": 2, "time_us": 197.2},
    "256": {"block_m": 32, "block_n": 256, "block_k": 128, "num_warps": 8, "num_stages": 1, "time_us": 198.9},
    "512": {"block_m": 64, "block_n": 256, "block_k": 128, "num_warps": 8, "num_stages": 2, "time_us": 218.2},
    "1024": {"block_m": 64, "block_n": 256, "block_k": 64, "num_warps": 4, "num_stages": 1, "time_us": 322.3},
    "1536": {"block_m": 64, "block_n": 256, "block_k": 64, "num_warps": 4, "num_stages": 1, "time_us": 401.7},
    "2048": {"block_m": 64, "block_n": 256, "block_k": 64, "num_warps": 4, "num_stages": 1, "time_us": 494.1},
    "3072": {"block_m": 64, "block_n": 256, "block_k": 64, "num_warps": 4, "num_stages": 1, "time_us": 717.6},
    "4096": {"block_m": 64, "block_n": 256, "block_k": 64, "num_warps": 4, "num_stages": 1, "time_us": 887.3}
  },
  "down": {
    "1": {"block_m": 16, "block_n": 32, "block_k": 128, "num_warps": 2, "num_stages": 3, "time_us": 16.3},
    "2": {"block_m": 16, "block_n": 128, "block_k": 128, "num_warps": 4, "num_stages": 3, "time_us": 29.8},
    "4": {"block_m": 16, "block_n": 32, "block_k": 128, "num_warps": 2, "num_stages": 3, "time_us": 49.3},
    "8": {"block_m": 16, "block_n": 64, "block_k": 128, "num_warps": 4, "num_stages": 3, "time_us": 68.8},
    "16": {"block_m": 16, "block_n": 32, "block_k": 128, "num_warps": 2, "num_stages": 1, "time_us": 87.8},
    "24": {"block_m": 16, "block_n": 128, "block_k": 64, "num_warps": 4, "num_stages": 3, "time_us": 101.5},
    "32": {"block_m": 16, "block_n": 128, "block_k": 128, "num_warps": 4, "num_stages": 1, "time_us": 99.7},
    "48": {"block_m": 16, "block_n": 256, "block_k": 128, "num_warps": 8, "num_stages": 1, "time_us": 101.6},
    "64": {"block_m": 16, "block_n": 32, "block_k": 128, "num_warps": 2, "num_stages": 2, "time_us": 103.4},
    "96": {"block_m": 32, "block_n": 256, "block_k": 128, "num_warps": 8, "num_stages": 1, "time_us": 104.4},
    "128": {"block_m": 64, "block_n": 128, "block_k": 128, "num_warps": 4, "num_stages": 1, "time_us": 110.1},
    "256": {"block_m": 32, "block_n": 128, "block_k": 128, "num_warps": 4, "num_stages": 1, "time_us": 111.9},
    "512": {"block_m": 64, "block_n": 256, "block_k": 64, "num_warps": 4, "num_stages": 1, "time_us": 128.4},
    "1024": {"block_m": 64, "block_n": 128, "block_k": 64, "num_warps": 4, "num_stages": 1, "time_us": 179.9},
    "1536": {"block_m": 64, "block_n": 256, "block_k": 64, "num_warps": 4, "num_stages": 1, "time_us": 231.7},
    "2048": {"block_m": 64, "block_n": 128, "block_k": 64, "num_warps": 4, "num_stages": 1, "time_us": 287.1},
    "3072": {"block_m": 64, "block_n": 256, "block_k": 64, "num_warps": 4, "num_stages": 1, "time_us": 416.2},
    "4096": {"block_m": 64, "block_n": 256, "block_k": 64, "num_warps": 4, "num_stages": 1, "time_us": 511.4}
  }
}
