kestrel-kernels/python/kestrel_kernels/configs/cute_moe_E64_H2048_I1024_fp8_sm90.json
{
  "description": "CuTe MoE FP8 kernel configs optimized for H100 (SM90)",
  "up": {
    "1": {
      "block_m": 16,
      "block_n": 128,
      "block_k": 128,
      "num_warps": 4,
      "num_stages": 3,
      "kernel_type": "warp",
      "time_us": 24.6
    },
    "2": {
      "block_m": 16,
      "block_n": 64,
      "block_k": 128,
      "num_warps": 4,
      "num_stages": 2,
      "kernel_type": "warp",
      "time_us": 37.1
    },
    "4": {
      "block_m": 16,
      "block_n": 64,
      "block_k": 128,
      "num_warps": 4,
      "num_stages": 1,
      "kernel_type": "warp",
      "time_us": 57.4
    },
    "8": {
      "block_m": 16,
      "block_n": 64,
      "block_k": 128,
      "num_warps": 2,
      "num_stages": 2,
      "kernel_type": "warp",
      "time_us": 76.9
    },
    "16": {
      "block_m": 16,
      "block_n": 64,
      "block_k": 128,
      "num_warps": 4,
      "num_stages": 8,
      "kernel_type": "warp",
      "time_us": 95.6
    },
    "24": {
      "block_m": 16,
      "block_n": 64,
      "block_k": 128,
      "num_warps": 4,
      "num_stages": 8,
      "kernel_type": "warp",
      "time_us": 105.6
    },
    "32": {
      "block_m": 16,
      "block_n": 64,
      "block_k": 128,
      "num_warps": 4,
      "num_stages": 8,
      "kernel_type": "warp",
      "time_us": 108.8
    },
    "48": {
      "block_m": 16,
      "block_n": 64,
      "block_k": 128,
      "num_warps": 4,
      "num_stages": 8,
      "kernel_type": "warp",
      "time_us": 111.0
    },
    "64": {
      "block_m": 16,
      "block_n": 64,
      "block_k": 128,
      "num_warps": 4,
      "num_stages": 8,
      "kernel_type": "warp",
      "time_us": 111.6
    },
    "96": {
      "block_m": 16,
      "block_n": 64,
      "block_k": 128,
      "num_warps": 4,
      "num_stages": 7,
      "kernel_type": "warp",
      "time_us": 114.3
    },
    "128": {
      "block_m": 16,
      "block_n": 128,
      "block_k": 128,
      "num_warps": 4,
      "num_stages": 6,
      "kernel_type": "warp",
      "time_us": 116.5
    },
    "256": {
      "block_m": 64,
      "block_n": 64,
      "block_k": 256,
      "num_warps": 4,
      "num_stages": 3,
      "kernel_type": "wgmma",
      "time_us": 272.8
    },
    "512": {
      "block_m": 64,
      "block_n": 256,
      "block_k": 128,
      "num_warps": 4,
      "num_stages": 4,
      "kernel_type": "wgmma",
      "time_us": 235.1
    },
    "1024": {
      "block_m": 64,
      "block_n": 256,
      "block_k": 128,
      "num_warps": 4,
      "num_stages": 5,
      "kernel_type": "wgmma",
      "time_us": 268.6
    },
    "1536": {
      "block_m": 64,
      "block_n": 256,
      "block_k": 128,
      "num_warps": 4,
      "num_stages": 2,
      "kernel_type": "wgmma",
      "time_us": 306.7
    },
    "2048": {
      "block_m": 64,
      "block_n": 256,
      "block_k": 128,
      "num_warps": 4,
      "num_stages": 2,
      "kernel_type": "wgmma",
      "time_us": 346.8
    },
    "3072": {
      "block_m": 192,
      "block_n": 256,
      "block_k": 64,
      "num_warps": 12,
      "num_stages": 4,
      "kernel_type": "wgmma",
      "time_us": 396.4
    },
    "4096": {
      "block_m": 192,
      "block_n": 256,
      "block_k": 64,
      "num_warps": 12,
      "num_stages": 4,
      "kernel_type": "wgmma",
      "time_us": 401.1
    }
  },
  "down": {
    "1": {
      "block_m": 16,
      "block_n": 64,
      "block_k": 128,
      "num_warps": 4,
      "num_stages": 6,
      "kernel_type": "warp",
      "time_us": 17.4
    },
    "2": {
      "block_m": 16,
      "block_n": 256,
      "block_k": 128,
      "num_warps": 8,
      "num_stages": 3,
      "kernel_type": "warp",
      "time_us": 20.8
    },
    "4": {
      "block_m": 16,
      "block_n": 64,
      "block_k": 128,
      "num_warps": 4,
      "num_stages": 1,
      "kernel_type": "warp",
      "time_us": 35.1
    },
    "8": {
      "block_m": 16,
      "block_n": 64,
      "block_k": 128,
      "num_warps": 2,
      "num_stages": 2,
      "kernel_type": "warp",
      "time_us": 44.8
    },
    "16": {
      "block_m": 16,
      "block_n": 64,
      "block_k": 128,
      "num_warps": 4,
      "num_stages": 5,
      "kernel_type": "warp",
      "time_us": 55.0
    },
    "24": {
      "block_m": 16,
      "block_n": 64,
      "block_k": 128,
      "num_warps": 4,
      "num_stages": 7,
      "kernel_type": "warp",
      "time_us": 60.3
    },
    "32": {
      "block_m": 16,
      "block_n": 64,
      "block_k": 128,
      "num_warps": 4,
      "num_stages": 7,
      "kernel_type": "warp",
      "time_us": 62.1
    },
    "48": {
      "block_m": 16,
      "block_n": 64,
      "block_k": 128,
      "num_warps": 4,
      "num_stages": 5,
      "kernel_type": "warp",
      "time_us": 63.7
    },
    "64": {
      "block_m": 16,
      "block_n": 64,
      "block_k": 128,
      "num_warps": 4,
      "num_stages": 5,
      "kernel_type": "warp",
      "time_us": 64.2
    },
    "96": {
      "block_m": 16,
      "block_n": 64,
      "block_k": 128,
      "num_warps": 4,
      "num_stages": 5,
      "kernel_type": "warp",
      "time_us": 65.2
    },
    "128": {
      "block_m": 16,
      "block_n": 128,
      "block_k": 128,
      "num_warps": 4,
      "num_stages": 6,
      "kernel_type": "warp",
      "time_us": 66.7
    },
    "256": {
      "block_m": 64,
      "block_n": 256,
      "block_k": 128,
      "num_warps": 4,
      "num_stages": 5,
      "kernel_type": "wgmma",
      "time_us": 174.6
    },
    "512": {
      "block_m": 64,
      "block_n": 256,
      "block_k": 256,
      "num_warps": 4,
      "num_stages": 1,
      "kernel_type": "wgmma",
      "time_us": 187.6
    },
    "1024": {
      "block_m": 64,
      "block_n": 256,
      "block_k": 128,
      "num_warps": 4,
      "num_stages": 4,
      "kernel_type": "wgmma",
      "time_us": 213.3
    },
    "1536": {
      "block_m": 64,
      "block_n": 256,
      "block_k": 128,
      "num_warps": 4,
      "num_stages": 2,
      "kernel_type": "wgmma",
      "time_us": 232.5
    },
    "2048": {
      "block_m": 64,
      "block_n": 256,
      "block_k": 128,
      "num_warps": 4,
      "num_stages": 1,
      "kernel_type": "wgmma",
      "time_us": 273.8
    },
    "3072": {
      "block_m": 192,
      "block_n": 256,
      "block_k": 128,
      "num_warps": 12,
      "num_stages": 3,
      "kernel_type": "wgmma",
      "time_us": 303.1
    },
    "4096": {
      "block_m": 192,
      "block_n": 256,
      "block_k": 64,
      "num_warps": 12,
      "num_stages": 4,
      "kernel_type": "wgmma",
      "time_us": 306.2
    }
  },
  "generated": "2026-01-07"
}
